project,repo,stars,forks,last_release,license,python_version,has_tests,has_local_db,has_cache,has_scheduler,token_required,public_web_dependency,decision,notes
akshare,akshare,27000,2300,2025-06,MIT,>=3.9,partial,false,false,false,optional,high,Fork,"Mature data scraping library with 200+ interfaces. Heavy web scraping dependency makes it fragile long-term. Fork to extract stable API patterns and local storage logic, remove web scraping."
efinance,efinance,3800,450,2024-10,MIT,3.6+,limited,false,false,false,false,medium,Borrow,"Clean architecture with East Money dependency. Good code structure for reference but limited without web access. Borrow API patterns, rebuild with local data."
mootdx,mootdx,2000,560,2023-12,MIT,3.8+,true,false,false,false,false,medium,Adopt,"TDX (通达信) data wrapper with stable server infrastructure. Good for historical K-line data. Adopt as secondary data source with local caching."
tushare,tushare,11000,1800,2024-12,MIT,3.7+,true,false,false,false,true,low,Fork,"Pro token-based API with official backend. Most reliable upstream but requires paid token. Fork to use free tier endpoints, implement local caching layer."
baostock,baostock,2100,380,2023-08,GPL-3.0,3.6+,true,false,false,false,true,low,Adopt,"Free API with historical data focus. Server reliability issues but no cost. Adopt as backup source, implement robust retry logic and local fallback."
cninfo-scrapers,cninfo-scrapers,65,12,2024-06,MIT,3.9+,false,false,false,false,false,high,Fork,"Specialized CNINFO disclosure scrapers. Narrow focus but valuable for regulatory filings. Fork to extract announcement parsing logic."
multi-source-aggregator,multi-source-aggregator,320,55,2024-08,MIT,3.8+,false,true,false,false,mixed,medium,Borrow,"Aggregator pattern with local caching. Good architecture reference. Borrow data fusion and caching patterns, not the web dependencies."